{
  "$schema": "https://json-schema.org/draft/2020-12/schema",
  "$id": "component.schema.json",
  "type": "object",
  "required": ["version", "id", "name", "implementation", "import", "variants", "sizes", "defaults", "visual", "requirements", "relatedRules"],
  "properties": {
    "$schema": { "type": "string" },
    "version": { "type": "string" },
    "id": { "type": "string", "pattern": "^component\\." },
    "name": { "type": "string", "minLength": 1 },
    "implementation": { "type": "string", "minLength": 1 },
    "import": { "const": "@heroui/react" },
    "variants": { "type": "array", "minItems": 1, "items": { "type": "string" }, "uniqueItems": true },
    "sizes": { "type": "array", "minItems": 1, "items": { "type": "string" }, "uniqueItems": true },
    "defaults": {
      "type": "object",
      "required": ["variant", "size"],
      "properties": {
        "variant": { "type": "string", "minLength": 1 },
        "size": { "type": "string", "minLength": 1 }
      },
      "additionalProperties": false
    },
    "visual": {
      "type": "object",
      "required": ["surfaceOwner", "outerShadow", "radiusToken"],
      "properties": {
        "surfaceOwner": { "enum": ["component", "none"] },
        "outerShadow": { "enum": ["forbidden", "allowed", "required"] },
        "radiusToken": { "type": "string", "pattern": "^radius\\." }
      },
      "additionalProperties": false
    },
    "anatomy": {
      "description": "この部品の構成要素として使用を許可する@heroui/reactのimport識別子",
      "type": "array",
      "minItems": 1,
      "items": { "type": "string", "minLength": 1 },
      "uniqueItems": true
    },
    "note": {
      "description": "シナリオから直接参照されないこの契約を、なぜ維持するかの理由",
      "type": "string",
      "minLength": 1
    },
    "requirements": { "type": "array", "minItems": 1, "items": { "type": "string" } },
    "relatedRules": { "type": "array", "minItems": 1, "items": { "type": "string" }, "uniqueItems": true },
    "usage": {
      "description": "この部品を使う場面と、使わない場面",
      "type": "object",
      "required": ["when", "avoid"],
      "properties": {
        "when": { "type": "array", "minItems": 1, "items": { "type": "string", "minLength": 1 } },
        "avoid": { "type": "array", "minItems": 1, "items": { "type": "string", "minLength": 1 } }
      },
      "additionalProperties": false
    },
    "accessibility": {
      "description": "実装時に満たすアクセシビリティ要件",
      "type": "array",
      "minItems": 1,
      "items": { "type": "string", "minLength": 1 }
    },
    "docsUrl": {
      "description": "HeroUI 公式ドキュメントの URL",
      "type": "string",
      "pattern": "^https://heroui\\.com/docs/react/components/[a-z-]+$"
    },
    "layout": {
      "type": "object",
      "minProperties": 1,
      "additionalProperties": { "type": "string" }
    }
  },
  "additionalProperties": false
}
