{
  "$schema": "../schemas/component.schema.json",
  "version": "1.1.0",
  "id": "component.table",
  "name": "Table",
  "implementation": "Table",
  "import": "@heroui/react",
  "variants": ["primary"],
  "sizes": ["md"],
  "defaults": {
    "variant": "primary",
    "size": "md"
  },
  "visual": {
    "surfaceOwner": "component",
    "outerShadow": "forbidden",
    "radiusToken": "radius.base"
  },
  "requirements": [
    "Table.Root、Table.ScrollContainer、Table.Contentの順に組み立てる",
    "標準variantはprimaryとし、Table自身の角丸へradius.baseを適用し、外側へ独自の背景、角丸、影を重ねない",
    "列はid、見出し、幅、最小幅、揃えを持つ定義配列として管理し、HeaderとRowで同じ定義を参照する",
    "一覧の識別子になる列へisRowHeaderを指定する",
    "詳細ビューへ移動する識別子はLinkにし、Buttonで画面遷移させない",
    "日付と数値は末尾揃えにし、font-variant-numeric: tabular-numsを適用する",
    "状態を色だけで示さない",
    "狭い画面では横スクロールへ押し込まず、情報の優先順位を保ったリストへ切り替える"
  ],
  "relatedRules": [
    "component.approved",
    "component.table.variant",
    "component.table.columns",
    "component.table.surface",
    "navigation.link-semantics",
    "a11y.color-only",
    "layout.narrow"
  ],
  "usage": {
    "when": ["同じ構造のレコードを一覧で比較・選択する画面", "広い画面で列ごとに並べ替えや絞り込みを行う一覧"],
    "avoid": ["768px 未満の画面。mobile-list を使う", "レコードの詳細を1件だけ見せる場面。Card や詳細画面を使う"]
  },
  "accessibility": ["aria-label で一覧の名前を付ける", "Table.Column に見出しを付け、列の意味をスクリーンリーダーに伝える", "行内のリンクは対象名を文言に含める"],
  "docsUrl": "https://heroui.com/docs/react/components/table"
}
