{
  "$schema": "../schemas/component.schema.json",
  "version": "1.0.0",
  "id": "component.select",
  "name": "Select",
  "implementation": "Select",
  "import": "@heroui/react",
  "variants": ["primary", "secondary"],
  "sizes": ["md"],
  "defaults": { "variant": "primary", "size": "md" },
  "visual": { "surfaceOwner": "component", "outerShadow": "allowed", "radiusToken": "radius.base" },
  "anatomy": ["ListBox"],
  "requirements": [
    "視覚的なLabelを付ける",
    "未選択と選択済みを区別する",
    "エラー時に回復方法を示す"
  ],
  "relatedRules": ["component.approved", "a11y.form-label", "a11y.error-recovery"]
}
