{
  "$schema": "../schemas/component.schema.json",
  "version": "1.1.0",
  "id": "component.form",
  "name": "Form",
  "implementation": "Form",
  "import": "@heroui/react",
  "variants": ["default"],
  "sizes": ["md"],
  "defaults": { "variant": "default", "size": "md" },
  "visual": { "surfaceOwner": "none", "outerShadow": "forbidden", "radiusToken": "radius.base" },
  "requirements": [
    "ひとまとまりで送信する入力をFormへまとめ、素のform要素で代用しない",
    "各入力にはLabelを付け、入力エラーは対象のFieldErrorで示す",
    "送信中は送信Buttonのloadingとdisabledを同期し、二重送信を防ぐ",
    "送信結果はFormの外側で消える通知だけに委ねず、失敗時は入力を保ったまま再試行できる状態にする"
  ],
  "relatedRules": ["component.approved", "a11y.form-label", "a11y.error-recovery", "state.loading"],
  "usage": {
    "when": ["登録や更新など、複数の入力をまとめて送信する場面", "Drawer 内の編集フォーム"],
    "avoid": ["検索など、送信しない入力のまとまり。Toolbar を使う", "1つの Form に無関係な複数の送信を持たせる"]
  },
  "accessibility": ["必須項目は isRequired で示し、送信前に検証する", "エラーは各入力欄の直下に出し、まとめて先頭にだけ出さない", "Enter キーで送信できるようにする"],
  "docsUrl": "https://heroui.com/docs/react/components/form"
}
